Cepillo Diente Feliz,Boca S.A.,Uruguay,+598 2380 3697,Av. 18 de Julio 965 - Montevideo - Uruguay
Desengrasante El Corrosón,Química Don Eusabio S.A.,Argentina,+54 0370 4425224,Pringles 648 - Formosa - Argentina
Papel higiénico La Lijadora (doble hoja),Corralón y más S.R.L.,Argentina,+54 11 4666 5484,Donovan y Camino Gral. Chamizo - Gerli - Argentina
Detergente Burbujotas,Química Don Eusabio S.A.,Argentina,+54 0370 4425224,Pringles 648 - Formosa - Argentina
Jabón de tocador Dog,One Eleven Inc.,Estados Unidos,+1 301 688 6311,1601 Pennsylvania Ave NW - Washington - DC 20500 - Estados Unidos
Cemento dental Pega Duro,Corralón y más S.R.L.,Argentina,+54 11 4666 5484,Donovan y Camino Gral. Chamizo - Gerli - Argentina
Desengrasante El Corrosón,Química Don Eusabio S.A.,Argentina,+54 0370 4425224,Pringles 648 - Formosa - Argentina
Detergente Limolandia,Chipotle Limpión S.A.,México,+52 01662 289 3065,Blvd. Miguel Hidalgo 79 - El Centenario - 83260 Hermosillo - Sonora - México
Jabón de tocador Espumosito,Todo Baño S.R.L.,Argentina,+54 381 4853329,Congreso 176 - San Miguel de Tucumán - Tucumán - Argentina
Hilo dental Lo Estamos Filmando,Bucolor S.A.S,Colombia,+57 4 4442563,Carrera 43 A N.º 7-50A - Medellín - Antioquia - Colombia
Papel higiénico Impecable,Todo Baño S.R.L.,Argentina,+54 381 4853329,Congreso 176 - San Miguel de Tucumán - Tucumán - Argentina
Jabón de tocador Dog,One Eleven Inc.,Estados Unidos,+1 301 688 6311,1601 Pennsylvania Ave NW - Washington - DC 20500 - Estados Unidos
Detergente Burbujotas,Química Don Eusabio S.A.,Argentina,+54 0370 4425224,Pringles 648 - Formosa - Argentina
Papel higiénico La Lijadora (doble hoja),Corralón y más S.R.L.,Argentina,+54 11 4666 5484,Donovan y Camino Gral. Chamizo - Gerli - Argentina
Lavandina Bromato de Armonio,Cloro Claro S.A.,Argentina,+54 2920 431484,Gral. Winter 72 - Viedma - Río Negro - Argentina
Pasta dentífrica Chau Sarro,Boca S.A.,Uruguay,+598 2380 3697,Av. 18 de Julio 965 - Montevideo - Uruguay
Papel higiénico Impecable,Todo Baño S.R.L.,Argentina,+54 381 4853329,Congreso 176 - San Miguel de Tucumán - Tucumán - Argentina
Detergente Limolandia,Chipotle Limpión S.A.,México,+52 01662 289 3065,Blvd. Miguel Hidalgo 79 - El Centenario - 83260 Hermosillo - Sonora - México
Cepillo Diente Feliz,Boca S.A.,Uruguay,+598 2380 3697,Av. 18 de Julio 965 - Montevideo - Uruguay
Papel higiénico La Lijadora (simple hoja),Corralón y más S.R.L.,Argentina,+54 11 4666 5484,Donovan y Camino Gral. Chamizo - Gerli - Argentina
